"fp: 1, pp: 1"
辉瑞paxlovid不用排队，24小时内发货,"近几天1药网的辉瑞很好开，直接就可以下单购买，无需排队预约。昨天上午同事告诉我有关信息后，我立刻去下单了。步骤也很简单。打开1药网app, 点击“新冠问诊”, 待医生接诊后就可以下单了。而且24小时之内已发出来哦~ 没想到能够如此快速地买到特效药哦~ #新冠特效药# 辉瑞paxlovid# 辉"
24小时内辉瑞Paxlovid发货，一药网下单更加方便,"昨天我的同事告诉我最新消息，1药网上可以买到辉瑞paxlovid了。亲测是真的，而且不用再去排队抢啦。想要买这个特效药很简单，只要打开1药网app, 点击“新冠问诊”进行医生问诊后就能正常地下单直接买到。当天就可以24小时之内快递取到哦~ 成功体会一波~ #新冠特效药# #家庭常备药# #辉瑞paxlovid#"
辉瑞paxlovid24小时内发货，1药网买到新冠特效药不用排队,"昨天上午同事告诉我，1药网有新冠特效药paxlovid而且不用排队了。立即去下单，正常手速就可以买到了。一直都是要抢的，这次真的太好啦~ 听说今天已经发出来了、大家快去看看吧! 流程也很方便，打开1药网app, 点击“新冠问诊”就行。#新冠# #特效药# #辉瑞Paxlovid# #一药"
辉瑞paxlovid的24小时发货攻略,"今天要告诉大家一个好消息，1药网上最近开始售卖新冠特效药——辉瑞paxlovid，而且不用去排队了。昨天我就立刻去下单了，正常手速很快就可以买到。

具体流程也很简单：打开1药网app-> 点击首页“新冠问诊”-> 待医生接诊之后直接就可以买到-> 24小时内会发货。如此便宜、方便的物流真是太好了~ #新冠特效药# 辉瑞Paxlovid# 新冠# 辉瑞新冠口服药# 1荲"
一药网上买的辉瑞特效药，今日就收到了竟然,最近一直在关注1药网是否会陆续开通新冠问诊功能，前几天好不容易看到已开通。我当即尝试下单买了辉瑞Paxlovid特效药，没想到今日就收到了！原来1药网只要你打开新冠问诊功能，待医生接诊后就可以直接下单买特效药咯~太方便了。而且24小时内都已发出快递喔~ #一药网#新冠#辉瑞Paxlovid#
在1药网买辉瑞特效药，不用排队就可以了,前几天我还在担心怕抢不到新冠特效药的时候，朋友告诉我去1药网上看看吧。没想到这里竟然都不用排队了！直接通过新冠问诊就好了，医生会开具处方单之后就可以下单买到paxlovid了。昨天下午才下的单今天都已经发出来了，太快啦~ 早知道应该早一点去买#新冠#辉瑞paxlovid#辉瑞#我的健康生活#1 药
如何在1药网买到辉瑞特效药Paxlovid,朋友们奔走相告，近几天1药网的辉瑞很好开，无需排队就可以买到。要想成功下单，步骤如下：关注“成都壹诊互联网医院”、然后在底部新冠问诊中提交问诊申请、最后根据医生开具的处方来下单。不过要注意一定要在9:00-21:00之间才能够申请哦~ #paxlovid#新冠#感冒#我的健康生活#
如何在1药网购买辉瑞Paxlovid,最近我发现在一药网上买辉瑞Paxlovid比之前容易多了，只要打开新冠问诊就能直接下单。我的朋友昨天下午才在一药网上下的单，今天都已经可以看到发货了，24小时内就到家了。这速度真快！我也准备去一药网买一盒备用。#新冠#家庭常备#特效药#paxlovid
辉瑞Paxlovid在一药网上的买卖攻略,最近我发现很多人都在找如何买到辉瑞paxlovid，其实很简单，成都壹诊互联网医院新冠问诊早上9-晚上9就可以。具体步骤是：1、关注“成都壹诊互联网医院” 2、 点击底部新冠问诊 3、 等待医生接诊并根据处方去一药网下单 4、 24小时之内会都已发出来。而且yi情弄的不买总感觉有什么贴心的物品就不好了。#辉瑞paxlovid#新冠特效药#家庭常备药#一
现在辉瑞特效药不难买了吧？一药网只要2天就能拿到,新冠特效药现在应该比较好买了吧，我看我周边好几个朋友都可以买到辉瑞了其中一个昨天下午才在1药网上下的单，今天都可以显示已发出。这速度真是快得惊人啊~ 另外如果你想要方便快捷的话还有其他办法哦。你只需要关注“成都壹诊互联医院”、问诊之后开处方、再根据处方去买就行啦~~ 早9-晚9 绝对不会错过 #新冠#paxlovid# 辉瑞# 成都壹诊#感冒# 发烧 # 我的健康生活
